Judul,Link
"Sejarah Muktamar NU 1926-2021, Ini Tema yang Dibahas",https://www.detik.com/edu/detikpedia/d-5864619/sejarah-muktamar-nu-1926-2021-ini-tema-yang-dibahas
Pendidikan Seks Susah Masuk Pesantren? Ini Komentar BKKBN,https://health.detik.com/berita-detikhealth/d-5854487/pendidikan-seks-susah-masuk-pesantren-ini-komentar-bkkbn
Kemenkes Akui Tak Mudah Masukkan Pendidikan Seks-Kespro ke Pesantren,https://health.detik.com/berita-detikhealth/d-5850555/kemenkes-akui-tak-mudah-masukkan-pendidikan-seks-kespro-ke-pesantren
Ustaz Yusuf Mansur dan Tudingan Penipu,https://hot.detik.com/celeb/d-5850478/ustaz-yusuf-mansur-dan-tudingan-penipu
Klarifikasi Ustaz Yusuf Mansur soal Tuduhan Penipu,https://hot.detik.com/celeb/d-5845096/klarifikasi-ustaz-yusuf-mansur-soal-tuduhan-penipu
"Dituduh Jadi Penipu, Ini Jawaban Ustaz Yusuf Mansur",https://hot.detik.com/celeb/d-5844615/dituduh-jadi-penipu-ini-jawaban-ustaz-yusuf-mansur
Serbuan Vaksinasi di Boyolali Mulai Sasar Para Santri Ponpes,https://news.detik.com/foto-news/d-5651451/serbuan-vaksinasi-di-boyolali-mulai-sasar-para-santri-ponpes
Serbuan Vaksinasi di Boyolali Mulai Sasar Para Santri Ponpes,https://news.detik.com/foto-news/d-5651451/serbuan-vaksinasi-di-boyolali-mulai-sasar-para-santri-ponpes
Cara Santri di Boyolali Ngabuburit Sambil Menari Sufi,https://news.detik.com/foto-news/d-5546939/cara-santri-di-boyolali-ngabuburit-sambil-menari-sufi
"Sungai Meluap, Belasan Rumah dan Satu Ponpes di Boyolali Kebanjiran",https://news.detik.com/berita-jawa-tengah/d-5797486/sungai-meluap-belasan-rumah-dan-satu-ponpes-di-boyolali-kebanjiran
PKI dan Rezim Rasan-Rasan,https://news.detik.com/kolom/d-5745245/pki-dan-rezim-rasan-rasan
"7.000 Anak di Jateng Yatim Piatu Karena Corona, Disiapkan 3 Desain Bantuan",https://news.detik.com/berita-jawa-tengah/d-5685459/7000-anak-di-jateng-yatim-piatu-karena-corona-disiapkan-3-desain-bantuan
"Klaster Hajatan di Boyolali: 30 Warga Kena Corona, Termasuk Ibu Hamil",https://news.detik.com/berita-jawa-tengah/d-5611683/klaster-hajatan-di-boyolali-30-warga-kena-corona-termasuk-ibu-hamil
"Corona di Kudus Masih Ngegas, Asrama Mahasiswa Disulap Jadi Tempat Isolasi",https://news.detik.com/berita-jawa-tengah/d-5607763/corona-di-kudus-masih-ngegas-asrama-mahasiswa-disulap-jadi-tempat-isolasi
35 Santri di Boyolali Kena Corona Usai Terima Tamu dari Kudus,https://news.detik.com/detiktv/d-5606902/35-santri-di-boyolali-kena-corona-usai-terima-tamu-dari-kudus
39 Santri di Ponpes Guru Ngaji Jokowi Positif Corona Usai Mudik Lebaran,https://news.detik.com/berita-jawa-tengah/d-5597579/39-santri-di-ponpes-guru-ngaji-jokowi-positif-corona-usai-mudik-lebaran
"Jelang Abu Bakar Ba'asyir Bebas, Kapolda Jateng: Pengamanannya Biasa",https://news.detik.com/berita-jawa-tengah/d-5324532/jelang-abu-bakar-baasyir-bebas-kapolda-jateng-pengamanannya-biasa
Wanti-wanti dari Senayan agar Pelacakan Massa HRS Tak Dihalang-halangi,https://news.detik.com/berita/d-5265696/wanti-wanti-dari-senayan-agar-pelacakan-massa-hrs-tak-dihalang-halangi
Kemenkes Beri Penghargaan Semua Pihak yang Tangani COVID-19,https://health.detik.com/advertorial-news-block/d-5254293/kemenkes-beri-penghargaan-semua-pihak-yang-tangani-covid-19
"Tak Pulang Karena Corona, Siswa Ponpes Buat Video Klip Islami",https://hot.detik.com/detiktv/d-4972774/tak-pulang-karena-corona-siswa-ponpes-buat-video-klip-islami
Panglima Domba yang Jadi Menteri Jokowi,https://finance.detik.com/wawancara-khusus/d-4807014/panglima-domba-yang-jadi-menteri-jokowi
